table,var,format,description,nomenclature,creation,suppression,dates_manquantes
T_MCOaaSUP_BPHNC,MNT_PHN_LAB_PRI,"number (10,2)",Montant total de PHN payés à un laboratoire privé ou un cabinet (en centimes d'euro),-,2010,2016,
T_MCOaaSUP_BPHNC,ETA_NUM,string (9),N° FINESS,-,2010,,
T_MCOaaSUP_BPHNC,MNT_LC_ETB_EXDG,"number (10,2)",Montant total d’actes de la LC dont la facture a été reçue  à un établissement de santé - ex-DG ou ex-OQN - (en centimes d'euro),-,2016,,
T_MCOaaSUP_BPHNC,MNT_LC_LAB_PRI,"number (10,2)",Montant total d’actes de la LC dont la facture a été reçue  à un laboratoire privé ou un cabinet (en centimes d'euro),-,2016,,
T_MCOaaSUP_BPHNC,MNT_RIHN_ETB_EXDG,"number (10,2)",Montant total d’actes du RIHN dont la facture a été reçue à un établissement de santé - ex-DG ou ex-OQN - (en centimes d'euro),-,2016,,
T_MCOaaSUP_BPHNC,MNT_BHN_LAB_PRI,"number (10,2)",Montant total de BHN payés à un laboratoire privé ou un cabinet (en centimes d'euro),-,2010,2016,
T_MCOaaSUP_BPHNC,MNT_RIHN_LAB_PRI,"number (10,2)",Montant total d’actes du RIHN dont la facture a été reçue à un laboratoire privé ou un cabinet (en centimes d'euro),-,2016,,
T_MCOaaSUP_BPHNC,FIC_TYP,string (3),Type de fichier,-,2010,,
T_MCOaaSUP_BPHNC,MNT_BHN_ETB_EXDG,"number (10,2)",Montant total de BHN payés à un établissement de santé - ex-DG ou ex-OQN - (en centimes d'euro),-,2010,2016,
T_MCOaaSUP_BPHNC,ANN_MOI,string (6),Année+Mois,-,2010,,
T_MCOaaSUP_BPHNP,MNT_PHN_ETB_EXDG,"number (10,2)",Montant total de PHN facturés à l'encontre d'un établissement de santé ex-DG (en centimes d'euro),-,2010,2016,
T_MCOaaSUP_BPHNP,MNT_LC_ETB_EXOQN,"number (10,2)",Montant total d’actes de la LC dont la facture a été émise  à l'encontre d'un établissement de santé ex-OQN (en centimes d'euro),-,2016,,
T_MCOaaSUP_BPHNP,MNT_PHN_LAB_PRI,"number (10,2)",Montant total de PHN facturés à l'encontre d'un laboratoire privé ou d'un cabinet (en centimes d'euro),-,2010,2016,
T_MCOaaSUP_BPHNP,MNT_RIHN_ETB_EXOQN,"number (10,2)",Montant total d’actes du RIHN dont la facture a été émise à l'encontre d'un établissement de santé ex-OQN (en centimes d'euro),-,2016,,
T_MCOaaSUP_BPHNP,ETA_NUM,string (9),N° FINESS,-,2010,,
T_MCOaaSUP_BPHNP,MNT_LC_ETB_EXDG,"number (10,2)",Montant total d’actes de la LC dont la facture a été émise  à l'encontre d'un établissement de santé ex-DG (en centimes d'euro),-,2016,,
T_MCOaaSUP_BPHNP,MNT_LC_LAB_PRI,"number (10,2)",Montant total d’actes de la LC dont la facture a été émise  à l'encontre d'un laboratoire privé ou d'un cabinet (en centimes d'euro),-,2016,,
T_MCOaaSUP_BPHNP,MNT_BHN_ETB_EXOQN,"number (10,2)",Montant total de BHN facturés à l'encontre d'un établissement de santé ex-OQN (en centimes d'euro),-,2010,2016,
T_MCOaaSUP_BPHNP,MNT_RIHN_ETB_EXDG,"number (10,2)",Montant total d’actes du RIHN dont la facture a été émise à l'encontre d'un établissement de santé ex-DG (en centimes d'euro),-,2016,,
T_MCOaaSUP_BPHNP,MNT_BHN_LAB_PRI,"number (10,2)",Montant total de BHN facturés à l'encontre d'un laboratoire privé ou d'un cabinet (en centimes d'euro),-,2010,2016,
T_MCOaaSUP_BPHNP,MNT_RIHN_LAB_PRI,"number (10,2)",Montant total d’actes du RIHN dont la facture a été émise à l'encontre d'un laboratoire privé ou d'un cabinet (en centimes d'euro),-,2016,,
T_MCOaaSUP_BPHNP,MNT_PHN_ETB_EXOQN,"number (10,2)",Montant total de PHN facturés à l'encontre d'un établissement de santé ex-OQN (en centimes d'euro),-,2010,2016,
T_MCOaaSUP_BPHNP,FIC_TYP,string (3),Type de fichier,-,2010,,
T_MCOaaSUP_BPHNP,MNT_BHN_ETB_EXDG,"number (10,2)",Montant total de BHN facturés à l'encontre d'un établissement de santé ex-DG (en centimes d'euro),-,2010,2016,
T_MCOaaSUP_BPHNP,ANN_MOI,string (6),Année+Mois,-,2010,,
T_MCOaaSUP_CES,CL_PLURI_PRO,string (1),consultations avec contact d’un autre professionnel,-,2014,,
T_MCOaaSUP_CES,NBR_PAT_SUP1,number (10),Le nombre de patients suivis depuis plus d’un an,-,2014,,
T_MCOaaSUP_CES,CONSULT_MIG,string (2),Code Consultation,-,2014,,
T_MCOaaSUP_CES,NBR_CONS_MIG,number (10),Le nombre total de consultations médicales pendant l’année,-,2014,,
T_MCOaaSUP_CES,FIC_TYP,string (3),Type de fichier,-,2014,,
T_MCOaaSUP_CES,CL_AUT_PRO,string (1),Autre professionnel (hors professionnel de santé),-,2014,,
T_MCOaaSUP_CES,NBR_PAT_CONS,number (10),La file active de patients (nombre de patients vus au moins une fois en consultation au cours de l’année),-,2014,,
T_MCOaaSUP_CES,NBR_PAT_NVX,number (10),Le nombre de patient vu pour la première fois cette année,-,2014,,
T_MCOaaSUP_CES,P_CONS_30_60,number (3),La durée des consultations entre 30 et 60 minutes,-,2014,,
T_MCOaaSUP_CES,CL_PARA_MED,string (1),"Autre professionnel de santé (psychologue, diététicien, masseur-kinésithérapeute)",-,2014,,
T_MCOaaSUP_CES,P_CONS_60_120,number (3),La durée des consultations entre 60 et 120 minutes,-,2014,,
T_MCOaaSUP_CES,ETA_NUM,string (9),N° FINESS,-,2014,,
T_MCOaaSUP_CES,ANN,string (4),Année,-,2014,,
T_MCOaaSUP_CES,CL_AUT_MED,string (1),Autre médecin,-,2014,,
T_MCOaaSUP_CES,NBR_PAT_SUP5,number (10),Le nombre de patient suivis depuis plus de 5 ans,-,2014,,
T_MCOaaSUP_CES,P_CONS_SUP_120,number (3),La durée des consultations supérieure à 120 minutes,-,2014,,
T_MCOaaSUP_CES,CL_ASS_SOC,string (1),Assistante sociale,-,2014,,
T_MCOaaSUP_CES,MOI,string (2),Période,-,2014,,
T_MCOaaSUP_FFM,ETA_NUM,string (9),Numéro FINESS d’inscription ePMSI,-,2015,2016,
T_MCOaaSUP_FFM,NBR_FFM,number (10),Nombre total réalisé,-,2015,2016,
T_MCOaaSUP_FFM,ANN_MOI,string (6),Année+Mois,-,2015,2016,
T_MCOaaSUP_FFM,FIC_TYP,string (3),Type de fichier,-,2015,2016,
T_MCOaaSUP_LACT,LAI_COL_PERS,number (7),Quantité de lait collecté pour don personnalisé (en litres),-,2015,,
T_MCOaaSUP_LACT,LAI_PAST_DIS_ANO,number (7),Quantité de lait pasteurisé congelé distribué au total dans le cadre du don anonyme (en litres),-,2015,,
T_MCOaaSUP_LACT,LAI_PAST_REQ_ANO,number (7),Quantité de lait pasteurisé congelé requalifié en don anonyme (en litres),-,2015,,
T_MCOaaSUP_LACT,LAI_COL_ANO,number (7),Quantité de lait collecté dans le cadre d'un don anonyme (en litres),-,2015,,
T_MCOaaSUP_LACT,LAI_PAST_VEND,number (7),Quantité de lait pasteurisé congelé vendu (en litres),-,2015,,
T_MCOaaSUP_LACT,LAI_LYOP_CONS,number (7),Quantité de lait lyophilisé consommé (en litres),-,2015,,
T_MCOaaSUP_LACT,ETA_NUM,string (9),Numéro FINESS d’inscription ePMSI,-,2010,,
T_MCOaaSUP_LACT,ETA_NUM_GEO,string (9),Numéro FINESS géographique,-,2015,,
T_MCOaaSUP_LACT,FIC_TYP,string (3),Type de fichier,-,2010,,
T_MCOaaSUP_LACT,LAI_CONG_CONS,number (7),Quantité de lait congelé consommé (en litres),-,2015,,
T_MCOaaSUP_LACT,ANN_MOI,string (6),Année+Mois,-,2010,,
T_MCOaaSUP_LACT,LAI_PAST_DIS_PERS,number (7),Quantité de lait pasteurisé congelé distribué pour don personnalisé (en litres),-,2015,,
T_MCOaaSUP_LACT,NBR_LLA_COL,number (7),Nombre de litres de lait collecté,-,2011,2015,
T_MCOaaSUP_LACT,QTE_LFC_CON_LIT,number (7),Quantité de lait frais ou congelé consommé (en litres),-,2010,2015,
T_MCOaaSUP_LACT,QTE_LLY_PRD_GR,number (7),Quantité de lait lyophilisé produit (en grammes),-,2010,2015,
T_MCOaaSUP_LACT,QTE_LLY_CON_GR,number (7),Quantité de lait lyophilisé consommé (en grammes),-,2010,2015,
T_MCOaaSUP_LACT,QTE_LFC_PRD_LIT,number (7),Quantité de lait frais ou congelé produit (en litres),-,2010,2015,
T_MCOaaSUP_PPCO,NBR_CONS_AUT_PS,number (10),·   Dont Nombre de consultations avec participation d'un autre professionnel de santé,-,2016,,
T_MCOaaSUP_PPCO,NBR_CONS_120_SUP,number (10),Nombre de consultations d'une durée supérieure à 120 minutes,-,2016,,
T_MCOaaSUP_PPCO,NBR_CONS_030_060,number (10),Nombre de consultations d'une durée comprise entre 30 et 60 minutes,-,2016,,
T_MCOaaSUP_PPCO,NBR_CONS_AUT_PRO,number (10),·   Dont Nombre de consultations avec participation d'un autre professionnel (hors professionnel de santé),-,2016,,
T_MCOaaSUP_PPCO,NBR_CONS_PLURI_PRO,number (10),Nombre total de consultations avec participation d'un autre intervenant,-,2016,,
T_MCOaaSUP_PPCO,NBR_CONS_PPCO_SC,number (10),·   Dont nb de consultations ayant également donné lieu à une prescription de chimiothérapie sous-cutanée,-,2016,,
T_MCOaaSUP_PPCO,NBR_CONS_060_120,number (10),Nombre de consultations d'une durée comprise entre 60 et 120 minutes,-,2016,,
T_MCOaaSUP_PPCO,NBR_PAT_PPCO_1ER_TRAIT,number (10),·   Le nombre de patients pour lesquels il s’agit d’un premier traitement de chimiothérapie orale,-,2016,,
T_MCOaaSUP_PPCO,FIC_TYP,string (3),Type de fichier,-,2016,,
T_MCOaaSUP_PPCO,NBR_CONS_ASS_SOC,number (10),·   Dont Nombre de consultations avec participation d'une assistante sociale,-,2016,,
T_MCOaaSUP_PPCO,NBR_CONS_AUT_MED,number (10),·   Dont Nombre de consultations avec participation d'un autre médecin,-,2016,,
T_MCOaaSUP_PPCO,NBR_PAT_PPCO_SUP_5AN,number (10),·   Le nombre de patient suivis pour un traitement du cancer depuis plus de 5 ans,-,2016,,
T_MCOaaSUP_PPCO,NBR_CONS_INFIRM,number (10),·   Dont Nombre de consultations avec participation d'un infirmier,-,2016,,
T_MCOaaSUP_PPCO,NBR_PAT_PPCO,number (10),Nombre total de patients ayant eu une consultation médicale de primo-prescription de traitement de chimiothérapie par voie orale pendant l’année,-,2016,,
T_MCOaaSUP_PPCO,NBR_CONS_PPCO,number (10),Nombre total de consultations médicales pour primo-prescription de traitement de chimiothérapie par voie orale pendant l’année,-,2016,,
T_MCOaaSUP_PPCO,NBR_CONS_PPCO_IV,number (10),·   Dont nb de consultations ayant également donné lieu à une prescription de chimiothérapie par voie IV,-,2016,,
T_MCOaaSUP_PPCO,NBR_PAT_PPCO_INF_1AN,number (10),·   Le nombre de patients vus pour la première fois cette année,-,2016,,
T_MCOaaSUP_PPCO,NBR_TOT_PAT,number (10),File active de patients ayant un traitement du cancer par chimiothérapie orale,-,2016,,
T_MCOaaSUP_PPCO,ETA_NUM,string (9),Numéro FINESS ePMSI,-,2016,,
T_MCOaaSUP_PPCO,NBR_PAT_PPCO_SUP_1AN,number (10),·   Le nombre de patients suivis pour un traitement du cancer depuis plus d’un an,-,2016,,
T_MCOaaSUP_PPCO,NBR_CONS_PHARMA,number (10),·   Dont Nombre de consultations avec participation d'un pharmacien,-,2016,,
T_MCOaaSUP_PPCO,NBR_CONS_000_030,number (10),Nombre de consultations d'une durée inférieure à 30 minutes,-,2016,,
T_MCOaaSUP_PPCO,ANN_MOI,string (6),Année+Mois,-,2016,,
T_MCOaaSUP_SMUR,ETA_NUM,string (9),Numéro FINESS ePMSI,-,2016,,
T_MCOaaSUP_SMUR,NBR_SOR_PRIM,number (6),Nombre de sorties primaires,-,2016,,
T_MCOaaSUP_SMUR,ETA_NUM_SMUR,string (9),N° FINESS d’implantation SMUR,-,2016,,
T_MCOaaSUP_SMUR,NBR_SOR_SND,number (6),Nombre de sorties secondaires,-,2016,,
T_MCOaaSUP_SMUR,ANN_MOI,string (6),Année+Mois,-,2016,,
T_MCOaaSUP_SMUR,FIC_TYP,string (3),Type de fichier,-,2016,,
T_MCOaaSUP_SMUR,NBR_TIIH,number (6),Nombre TIIH (transfert infirmier inter-hospitalier),-,2016,,
T_MCOaaSUP_USMP,ETA_NUM,string (9),N° FINESS d’inscription e-PMSI,-,2016,,
T_MCOaaSUP_USMP,MNT_TOT_TTC,number (9),Montant total TTC,-,2016,,
T_MCOaaSUP_USMP,FIC_TYP,string (3),Type de fichier,-,2016,,
T_MCOaaSUP_USMP,UCD_COD_7_13,string (13),Code UCD (7 ou 13),-,2016,,
T_MCOaaSUP_USMP,ANN_MOI,string (6),Année+Mois,-,2016,,
T_MCOaaUM,ACT_RUM_NBR,number (3),Nombre de zones d'actes du RUM (Nb_Act_R_1),-,2010,,
T_MCOaaUM,AGE_GES,number (2),Age gestationnel du RUM,-,2014,,
T_MCOaaUM,AUT_TYP1_UM,string (4),Premier type d'autorisation d'UM,-,2010,,
T_MCOaaUM,AUT_TYP2_UM,string (4),Deuxième type d'autorisation d'UM,-,2010,,
T_MCOaaUM,DGN_ASS_NBR,number (2),Nombre de diagnostics associés du RUM (Nb_DA_R_1),-,2010,,
T_MCOaaUM,DGN_PAL,string (6),DP,MS_CIM_V,2008,,
T_MCOaaUM,DGN_REL,string (6),DR,MS_CIM_V,2008,,
T_MCOaaUM,ETA_NUM,string (9),Numéro FINESS e-PMSI,-,2006,,
T_MCOaaUM,ETA_NUM_GEO,string (9),Premier numéro FINESS géographique,-,2013,,
T_MCOaaUM,IGS2_COD,string (3),IGS2,-,2010,,
T_MCOaaUM,PAR_DUR_SEJ,number (4),Durée séjour partielle,-,2010,,
T_MCOaaUM,RSA_NUM,string (10),N° d'index du RSA,-,2006,,
T_MCOaaUM,RSS_NUM,string (3),Numéro de version du format du RSA,-,2006,,
T_MCOaaUM,SUP_TYP1_NAT,string (2),Nature du supplément pour le premier type,-,2010,,
T_MCOaaUM,SUP_TYP1_NBR,number (4),Nombre de supplément pour le premier type,-,2010,,
T_MCOaaUM,SUP_TYP2_NAT,string (2),Nature du supplément pour le deuxième type,-,2010,,
T_MCOaaUM,SUP_TYP2_NBR,number (4),Nombre de supplément pour le deuxième type,-,2010,,
T_MCOaaUM,UM_ORD_NUM,number (2),N° séquentiel de RUM,-,2010,,
T_MCOaaUM,UM_TYP,string (2),Type d'UM,-,2006,2010,
T_MCOaaUM,DP_POS,string (10),Position du DP,-,2006,2008,
T_MCOaaUM,VAL_PAR,string (1),Valorisation partielle,-,2006,2010,
T_MCOaaUM,ETA_NUM_GEO2,string (9),Deuxième numéro FINESS géographique,-,2012,2013,
T_MCOaaUM,VAL_REA,string (1),Valorisation réa,-,2006,2010,
T_MCOaaUM,IND_SRC,string (1),Indicateur de SRC,-,2009,2010,
T_MCOaaUM,ETA_NUM_GEO1,string (9),Premier numéro FINESS géographique,-,2012,2013,
T_MCOaaUM,PAR_NBR_SEJ,number,Durée séjour partielle,-,2006,2010,
T_MCOaaUPGV,AUT_TYP_PGV,string (2),Type d'autorisation à portée globale valide,-,2012,,
T_MCOaaUPGV,ETA_NUM,string (9),Numéro FINESS,-,2012,,
T_MCOaaUPGV,RSA_NUM,string (10),N° d'index du RSA,-,2012,,
T_MCOaaUPGV,RSS_NUM,string (3),Numéro de version du format du RSA,-,2012,,
T_MCOaaVALO,COEFGEO,"number (3,2)",Coefficient géographique,-,2011,,
T_MCOaaVALO,COEFPRUD,"number (5,4)",coefficient prudentiel,-,2014,,
T_MCOaaVALO,COEFTRANS,"number (5,4)",Coefficient de transition,-,2011,,
T_MCOaaVALO,ETA_NUM,string (9),Numéro FINESS de l’établissement,-,2011,,
T_MCOaaVALO,ETE_GHS_NUM,number (4),GHS au format DCIR,-,2011,,
T_MCOaaVALO,FLAG_FIDES,string (1),Indicateur FIDES GENRSA ; vaut 1 si le séjour est pris en charge dans le cadre de FIDES,-,2014,,
T_MCOaaVALO,GHS_NUM,string (4),Numéro du GHS,-,2011,,
T_MCOaaVALO,GHS50,number (5),Nb séjours avec réhospitalisation dans le même GHM,-,2011,,
T_MCOaaVALO,MNT_18,"number (10,2)",Montant participation forfaitaire du 18 euros,-,2011,,
T_MCOaaVALO,MNT_9610_AM,"number (10,2)",Valorisation AM actes menant dans le GHS 9610,-,2011,,
T_MCOaaVALO,MNT_9615_AM,"number (10,2)",Valorisation AM actes menant dans le GHS 9615,-,2011,,
T_MCOaaVALO,MNT_9619_AM,"number (10,2)",Valorisation AM actes menant dans le GHS 9619,-,2011,,
T_MCOaaVALO,MNT_9620_AM,"number (10,2)",Valorisation AM actes menant dans le GHS 9620,-,2011,,
T_MCOaaVALO,MNT_9621_AM,"number (10,2)",Valorisation AM actes menant dans le GHS 9621,-,2011,,
T_MCOaaVALO,MNT_9622_AM,"number (10,2)",Valorisation AM actes menant dans le GHS 9622,-,2011,,
T_MCOaaVALO,MNT_9623_AM,"number (10,2)",Valorisation AM actes menant dans le GHS 9623,-,2012,,
T_MCOaaVALO,MNT_9625_AM,"number (10,2)",Valorisation AM actes menant dans le GHS 9625,-,2011,,
T_MCOaaVALO,MNT_9631_AM,"number (10,2)",Valorisation AM actes menant dans le GHS 9631,-,2011,,
T_MCOaaVALO,MNT_9632_AM,"number (10,2)",Valorisation AM actes menant dans le GHS 9632,-,2011,,
T_MCOaaVALO,MNT_9633_AM,"number (10,2)",Valorisation AM actes menant dans le GHS 9633,-,2011,,
T_MCOaaVALO,MNT_ANT_AM,"number (10,2)",Valorisation AM suppléments antepartum,-,2012,,
T_MCOaaVALO,MNT_CAISSON_AM,"number (10,2)",Valorisation AM suppléments caisson hyperbare,-,2011,,
T_MCOaaVALO,MNT_DIP_AM,"number (10,2)",Valorisation AM suppléments de dialyse DIP,-,2011,,
T_MCOaaVALO,MNT_DMI,"number (10,2)",Valorisation accordée DMI,-,2011,,
T_MCOaaVALO,MNT_EXH_AM,"number (10,2)",Valorisation AM EXH,-,2011,,
T_MCOaaVALO,MNT_EXINF_AM,"number (10,2)",Valorisation AM EXB,-,2011,,
T_MCOaaVALO,MNT_FJ2,"number (10,2)",Montant du forfait journalier,-,2011,,
T_MCOaaVALO,MNT_GHS_AM,"number (10,2)",Valorisation AM GHS,-,2011,,
T_MCOaaVALO,MNT_GHS50_AM,"number (10,2)",Valorisation AM des séjours avec réhospitalisation dans le même GHM,-,2011,,
T_MCOaaVALO,MNT_IVG_AM,"number (10,2)",Valorisation AM IVG (hors FJS),-,2011,,
T_MCOaaVALO,MNT_MAJO,"number (10,2)",Montant majoration du parcours de soin,-,2011,,
T_MCOaaVALO,MNT_MED_ATU,"number (10,2)",Valorisation accordée médicaments ATU/POST ATU,-,2017,,
T_MCOaaVALO,MNT_MON,"number (10,2)",Valorisation accordée molécules onéreuses,-,2011,,
T_MCOaaVALO,MNT_NN1_AM,"number (10,2)",Valorisation AM suppléments de néonat sans SI,-,2011,,
T_MCOaaVALO,MNT_NN2_AM,"number (10,2)",Valorisation AM suppléments de néonat avec SI,-,2011,,
T_MCOaaVALO,MNT_NN3_AM,"number (10,2)",Valorisation AM suppléments de réanimation néonat,-,2011,,
T_MCOaaVALO,MNT_PO1_AM,"number (10,2)",Valorisation AM PO1,-,2011,,
T_MCOaaVALO,MNT_PO2_AM,"number (10,2)",Valorisation AM PO2,-,2011,,
T_MCOaaVALO,MNT_PO3_AM,"number (10,2)",Valorisation AM PO3,-,2011,,
T_MCOaaVALO,MNT_PO4_AM,"number (10,2)",Valorisation AM PO4,-,2011,,
T_MCOaaVALO,MNT_PO5_AM,"number (10,2)",Valorisation AM PO5,-,2011,,
T_MCOaaVALO,MNT_PO6_AM,"number (10,2)",Valorisation AM PO6,-,2011,,
T_MCOaaVALO,MNT_PO7_AM,"number (10,2)",Valorisation AM PO7,-,2011,,
T_MCOaaVALO,MNT_PO8_AM,"number (10,2)",Valorisation AM PO8,-,2011,,
T_MCOaaVALO,MNT_PO9_AM,"number (10,2)",Valorisation AM PO9,-,2011,,
T_MCOaaVALO,MNT_POA_AM,"number (10,2)",Valorisation AM POA,-,2012,,
T_MCOaaVALO,MNT_RAC,"number (10,2)",Montant remboursable par l'organisme complémentaire (AMC),-,2016,,
T_MCOaaVALO,MNT_RAP_AM,"number (10,2)",Valorisation AM suppléments de radiothérapie pédiatrique,-,2012,,
T_MCOaaVALO,MNT_REA_AM,"number (10,2)",Valorisation AM suppléments de réanimation,-,2011,,
T_MCOaaVALO,MNT_REP_AM,"number (10,2)",Valorisation AM suppléments de réanimation pédiatrique,-,2011,,
T_MCOaaVALO,MNT_SC_AM,"number (10,2)",Valorisation AM suppléments de surveillance continue,-,2011,,
T_MCOaaVALO,MNT_SI_AM,"number (10,2)",Valorisation AM suppléments soins intensifs,-,2011,,
T_MCOaaVALO,MNT_SUPPENT1_AM,"number (10,2)",Valorisation AM suppléments pour entraînements à la dialyse péritonéale automatisée hors séance,-,2011,,
T_MCOaaVALO,MNT_SUPPENT2_AM,"number (10,2)",Valorisation AM suppléments pour entraînements à la dialyse péritonéale continue ambulatoire hors séance,-,2011,,
T_MCOaaVALO,MNT_SUPPENT3_AM,"number (10,2)",Valorisation AM suppléments pour entraînements à l’hémodialyse hors séance,-,2011,,
T_MCOaaVALO,MNT_SUPPHD_AM,"number (10,2)",Valorisation AM suppléments pour hémodialyse hors séance,-,2011,,
T_MCOaaVALO,MNT_TOT_AM,"number (10,2)",Valorisation totale AM du séjour.,-,2011,,
T_MCOaaVALO,NB_9610,number (5),Nombre d’actes menant dans le GHS 9610,-,2011,,
T_MCOaaVALO,NB_9615,number (5),Nombre d’actes menant dans le GHS 9615,-,2011,,
T_MCOaaVALO,NB_9619,number (5),Nombre d’actes menant dans le GHS 9619,-,2011,,
T_MCOaaVALO,NB_9620,number (5),Nombre d’actes menant dans le GHS 9620,-,2011,,
T_MCOaaVALO,NB_9621,number (5),Nombre d’actes menant dans le GHS 9621,-,2011,,
T_MCOaaVALO,NB_9622,number (5),Nombre d’actes menant dans le GHS 9622,-,2011,,
T_MCOaaVALO,NB_9623,number (5),Nombre d’actes menant dans le GHS 9623,-,2012,,
T_MCOaaVALO,NB_9625,number (5),Nombre d’actes menant dans le GHS 9625,-,2011,,
T_MCOaaVALO,NB_9631,number (5),Nombre d’actes menant dans le GHS 9631,-,2011,,
T_MCOaaVALO,NB_9632,number (5),Nombre d’actes menant dans le GHS 9632,-,2011,,
T_MCOaaVALO,NB_9633,number (5),Nombre d’actes menant dans le GHS 9633,-,2011,,
T_MCOaaVALO,NB_ANT,number (5),Nb suppléments antepartum,-,2012,,
T_MCOaaVALO,NB_DIP,number (5),Nb suppléments dialyse DIP,-,2011,,
T_MCOaaVALO,NB_NN1,number (5),Nb suppléments de néonat sans SI,-,2011,,
T_MCOaaVALO,NB_NN2,number (5),Nb suppléments de néonat avec SI,-,2011,,
T_MCOaaVALO,NB_NN3,number (5),Nb suppléments de réanimation néonat,-,2011,,
T_MCOaaVALO,NB_RAP,number (5),Nb suppléments de radiothérapie pédiatrique,-,2012,,
T_MCOaaVALO,NB_SRC2,number (5),Nb suppléments de surveillance continue,-,2011,,
T_MCOaaVALO,NB_STF2,number (5),Nb suppléments de soins intensifs,-,2011,,
T_MCOaaVALO,NBCAISSON,number (5),Nb suppléments caisson hyperbare,-,2011,,
T_MCOaaVALO,NBEXB,number (5),Nb journées EXB,-,2011,,
T_MCOaaVALO,NBEXH,number (5),Nombre de journées EXH,-,2011,,
T_MCOaaVALO,NBJREA,number (5),Nb suppléments de réanimation,-,2011,,
T_MCOaaVALO,NBREP,number (5),Nb suppléments de réanimation pédiatrique,-,2011,,
T_MCOaaVALO,PONDER,number (5),Nombre de séjours ou nombre de séances,-,2011,,
T_MCOaaVALO,RSA_NUM,string (10),Numéro de séjour RSS,-,2011,,
T_MCOaaVALO,SEJXINF,string (1),Type de séjour inférieur à la borne extrême basse,-,2011,,
T_MCOaaVALO,SUPPENT1,number (5),Nb suppléments pour entraînements à la dialyse péritonéale automatisée hors séance,-,2011,,
T_MCOaaVALO,SUPPENT2,number (5),Nb suppléments pour entraînements à la dialyse péritonéale continue ambulatoire hors séance,-,2011,,
T_MCOaaVALO,SUPPENT3,number (5),Nb suppléments pour entraînements à l’hémodialyse hors séance,-,2011,,
T_MCOaaVALO,SUPPHD,number (5),Nb suppléments pour hémodialyse hors séance,-,2011,,
T_MCOaaVALO,TAUX2,"number (5,2)",Taux de remboursement,-,2011,,
T_MCOaaVALO,TYPORG,string (1),"Type de prestation de prélèvement d’organe (type 1, 2, 3 ou 4)",-,2011,,
T_MCOaaVALO,TYPORG5,string (1),Prélèvement d’organe de type 5,-,2011,,
T_MCOaaVALO,TYPORG6,string (1),Prélèvement d’organe de type 6,-,2011,,
T_MCOaaVALO,TYPORG7,string (1),Prélèvement d’organe de type 7,-,2011,,
T_MCOaaVALO,TYPORG8,string (1),Prélèvement d’organe de type 8,-,2011,,
T_MCOaaVALO,TYPORG9,string (1),Prélèvement d’organe de type 9,-,2011,,
T_MCOaaVALO,TYPORGA,string (1),Prélèvement d’organe de type A,-,2012,,
T_MCOaaVALO,VALO,string (1),Type de valorisation du séjour,-,2011,,
T_MCOaaVALO,MNT_GHS_BR,number,Valorisation BR GHS,-,,,
T_MCOaaVALO,MNT_EXINF_BR,number,Valorisation BR EXB,-,,,
T_MCOaaVALO,MNT_GHS50_BR,number,Valorisation BR des séjours avec réhospitalisation dans le même GHM,-,,,
T_MCOaaVALO,MNT_EXH_BR,number,Valorisation BR EXH,-,,,
T_MCOaaVALO,MNT_SUPPHD_BR,number,Valorisation BR suppléments pour hémodialyse hors séance,-,,,
T_MCOaaVALO,MNT_SUPPENT1_BR,number,Valorisation BR suppléments pour entraînements à la dialyse péritonéale automatisée hors séance,-,,,
T_MCOaaVALO,MNT_SUPPENT2_BR,number,Valorisation BR suppléments pour entraînements à la dialyse péritonéale continue ambulatoire hors séance,-,,,
T_MCOaaVALO,MNT_SUPPENT3_BR,number,Valorisation BR suppléments pour entraînements à l’hémodialyse hors séance,-,,,
T_MCOaaVALO,MNT_DIP_BR,number,Valorisation BR suppléments de dialyse DIP,-,,,
T_MCOaaVALO,MNT_PO1_BR,number,Valorisation BR PO1,-,,,
T_MCOaaVALO,MNT_PO2_BR,number,Valorisation BR PO2,-,,,
T_MCOaaVALO,MNT_PO3_BR,number,Valorisation BR PO3,-,,,
T_MCOaaVALO,MNT_PO4_BR,number,Valorisation BR PO4,-,,,
T_MCOaaVALO,MNT_PO5_BR,number,Valorisation BR PO5,-,,,
T_MCOaaVALO,MNT_PO6_BR,number,Valorisation BR PO6,-,,,
T_MCOaaVALO,MNT_PO7_BR,number,Valorisation BR PO7,-,,,
T_MCOaaVALO,MNT_PO8_BR,number,Valorisation BR PO8,-,,,
T_MCOaaVALO,MNT_PO9_BR,number,Valorisation BR PO9,-,,,
T_MCOaaVALO,MNT_POA_BR,number,Valorisation BR POA,-,,,
T_MCOaaVALO,MNT_9610_BR,number,Valorisation BR actes menant dans le GHS 9610,-,,,
T_MCOaaVALO,MNT_9619_BR,number,Valorisation BR actes menant dans le GHS 9619,-,,,
T_MCOaaVALO,MNT_9620_BR,number,Valorisation BR actes menant dans le GHS 9620,-,,,
T_MCOaaVALO,MNT_9621_BR,number,Valorisation BR actes menant dans le GHS 9621,-,,,
T_MCOaaVALO,MNT_9622_BR,number,Valorisation BR actes menant dans le GHS 9622,-,,,
T_MCOaaVALO,MNT_9623_BR,number,Valorisation BR actes menant dans le GHS 9623,-,,,
T_MCOaaVALO,MNT_9625_BR,number,Valorisation BR actes menant dans le GHS 9625,-,,,
T_MCOaaVALO,MNT_9631_BR,number,Valorisation BR actes menant dans le GHS 9631,-,,,
T_MCOaaVALO,MNT_9632_BR,number,Valorisation BR actes menant dans le GHS 9632,-,,,
T_MCOaaVALO,MNT_9633_BR,number,Valorisation BR actes menant dans le GHS 9633,-,,,
T_MCOaaVALO,MNT_9615_BR,number,Valorisation BR actes menant dans le GHS 9615,-,,,
T_MCOaaVALO,MNT_REA_BR,number,Valorisation BR suppléments de réanimation,-,,,
T_MCOaaVALO,MNT_REP_BR,number,Valorisation BR suppléments de réanimation pédiatrique,-,,,
T_MCOaaVALO,MNT_SI_BR,number,Valorisation BR suppléments soins intensifs,-,,,
T_MCOaaVALO,MNT_SC_BR,number,Valorisation BR suppléments de surveillance continue,-,,,
T_MCOaaVALO,MNT_NN1_BR,number,Valorisation BR suppléments de néonat sans SI,-,,,
T_MCOaaVALO,MNT_NN2_BR,number,Valorisation BR suppléments de néonat avec SI,-,,,
T_MCOaaVALO,MNT_NN3_BR,number,Valorisation BR suppléments de réanimation néonat,-,,,
T_MCOaaVALO,MNT_CAISSON_BR,number,Valorisation BR suppléments caisson hyperbare,-,,,
T_MCOaaVALO,MNT_RAP_BR,number,Valorisation BR suppléments de radiothérapie pédiatrique,-,,,
T_MCOaaVALO,MNT_ANT_BR,number,Valorisation BR suppléments antepartum,-,,,
T_MCOaaVALO,NB_SDC,number,Nb suppléments défibrillateur cardiaque,-,,,
T_MCOaaVALO,MNT_SDC_BR,number,Valorisation BR suppléments défibrillateur cardiaque,-,,,
T_MCOaaVALO,MNT_SDC_AM,number,Valorisation AM suppléments défibrillateur cardiaque,-,,,
T_MCOaaVALO,MNT_IVG_BR,number,Valorisation BR IVG,-,,,
