table,var,format,description,nomenclature,creation,suppression,dates_manquantes
IR_IMB_R,IMB_ETM_NAT,number (2),Motif d'exonération du bénéficiaire,IR_ETM_V,,,
IR_IMB_R,IMB_MLP_BTR,string (1),"Tableau des maladies professionnelles (bis, ter)",-,,,
IR_IMB_R,IMB_MLP_TAB,string (3),Numéro de tableau des maladies professionnelles (MP),AT_MLP_V,,,
IR_IMB_R,IMB_SDR_LOP,string (1),Localisation - paragraphe syndrome,-,,,
IR_IMB_R,INS_DTE,date (8),Date d'insertion,-,,,
IR_IMB_R,MED_MTF_COD,string (5),Motif médical ou pathologie (code CIM10),IR_CIM_V,,,
IR_IMB_R,MED_NCL_IDT,string (10),Nomenclature médicale,IR_NMD_V,,,
IR_IMB_R,UPD_DTE,date (8),Date de la dernière sélection des bénéficiaires de l'EGB,-,,,
IR_MAT_R,BEN_NIR_PSA,string (17),Identifiant anonyme du patient dans le SNIIRAM,-,,,
IR_MAT_R,BEN_RNG_GEM,number (2),rang de naissance du bénéficiaire,IR_BER_V,,,
IR_MAT_R,BEN_NIR_ANO,string (17),NIR pseudonymisé du bénéficiaire,-,,,
IR_MAT_R,BEN_IDT_ANO,string (18),Identifiant bénéficiaire anonymisé,-,,,
IR_MAT_R,BEN_GRS_DTE,date,Date présumée de grossesse,-,,,
IR_MAT_R,BEN_DRA_AME,string (6),Année et mois de l’accouchement,-,,,
IR_MAT_R,IND_RNM_BEN,string (1),Top RNIAM,-,,,
IR_MTT_R,BEN_NIR_PSA,string (17),Identifiant anonyme du patient dans le SNIIRAM,-,,,
IR_MTT_R,BEN_RNG_GEM,number (2),rang de naissance du bénéficiaire,IR_BER_V,,,
IR_MTT_R,BEN_NIR_ANO,string (17),NIR pseudonymisé du bénéficiaire,-,,,
IR_MTT_R,BEN_IDT_ANO,string (18),Identifiant bénéficiaire anonymisé,-,,,
IR_MTT_R,IND_RNM_BEN,string (1),Top RNIAM,-,,,
IR_MTT_R,MTT_DEP_DTE,date,date de début du contrat avec le médecin traitant,-,,,
IR_MTT_R,MTT_FIN_DTE,date,date de fin du contrat avec le médecin traitant,-,,,
IR_MTT_R,MTT_MTF_COD,string (3),Motif de résiliation du contrat avce le médecin traitant,-,,,
IR_MTT_R,MTT_ORI_COD,string (1),Origine de la saisie ou de la mise à jour de la déclaration de médecin traitant,-,,,
IR_MTT_R,MTT_PFS_NUM,string (17),Numéro du médecin traitant,-,,,
IR_ORC_R,BEN_NIR_PSA,string (17),Identifiant anonyme du patient dans le SNIIRAM,-,,,
IR_ORC_R,BEN_RNG_GEM,number (2),rang de naissance du bénéficiaire,IR_BER_V,,,
IR_ORC_R,BEN_NIR_ANO,string (17),NIR pseudonymisé du bénéficiaire,-,,,
IR_ORC_R,BEN_IDT_ANO,string (18),Identifiant bénéficiaire anonymisé,-,,,
IR_ORC_R,BEN_CTA_TYP,number (3),Type de contrat complémentaire,IR_CTA_V,,,
IR_ORC_R,BEN_CMU_ORG,string (9),Code de l'organisme complémentaire,IR_ORG_V,,,
IR_ORC_R,MLL_CTA_DSD,date,Date de début du contrat complémentaire,-,,,
IR_ORC_R,MLL_CTA_DSF,date,Date de fin du contrat complémentaire,-,,,
IR_ORC_R,IND_RNM_BEN,string (1),Top RNIAM,-,,,
KI_CCI_R,DCD_IDT_ENC,string (64),Identifiant décès encodé,-,2013,,
KI_CCI_R,DCD_IDT_TOP,number (1),Top apparié avec IR_BEN_R,-,2013,,
KI_CCI_R,BEN_IDT_ANO,string (18),Identifiant bénéficiaire anonymisé,-,2013,,
KI_CCI_R,BEN_IDT_TOP,number (1),Top identifiant bénéficiaire Anonymisé,-,2013,,
KI_CCI_R,BEN_NIR_ANO,string (17),NIR pseudonymisé du bénéficiaire,-,2013,,
KI_CCI_R,FLX_PER_ANN,string (4),Année de décès,-,2013,,
KI_CCI_R,CER_VER_NUM,number (1),Version du certificat,DS_VER_V,2013,,
KI_CCI_R,TRT_STA_COD,number (1),Statut de traitement,DS_STA_V,2013,,
KI_CCI_R,TYP_CER_COD,number (1),Type de certificat,DS_CER_V,2013,,
KI_CCI_R,CER_SUP_TYP,number (1),Type de support,DS_SUP_V,2013,,
KI_CCI_R,TYP_VOL_COD,number (1),Type de volet,DS_VOL_V,2013,,
KI_CCI_R,DCD_DPT_COD,string (3),Département de décès,IR_DPT_V,2013,,
KI_CCI_R,DCD_COM_COD,string (3),Commune de décès,IR_GEO_V,,,
KI_CCI_R,BEN_RES_DPT,string (3),Département de résidence du bénéficiaire,IR_DPT_V,2013,,
KI_CCI_R,BEN_RES_COM,string (3),commune de résidence du destinataire du règlement,IR_GEO_V,2013,,
KI_CCI_R,BEN_DCD_DTE,date (8),Date de décès du bénéficiaire,IR_DTE_V,2013,,
KI_CCI_R,BEN_DCD_AME,string (6),Année et mois de décès du bénéficiaire,-,2013,,
KI_CCI_R,DCD_LIE_COD,number (1),Lieu du décès,DS_LIE_V,2013,,
KI_CCI_R,BEN_NAI_ANN,string (4),Année de naissance du bénéficiaire,-,2013,,
KI_CCI_R,BEN_NAI_MOI,string (2),Mois de naissance du bénéficiaire,-,2013,,
KI_CCI_R,BEN_SEX_COD,number (1),Code sexe du bénéficiaire,IR_SEX_V,2013,,
KI_CCI_R,PFV_ACP_COD,number (1),Activité professionnelle,DS_ACP_V,2013,,
KI_CCI_R,CAT_PCS_COD,string (4),Profession et catégorie socioprofessionnelle,DS_PC1_V,2013,,
KI_CCI_R,ETA_MAR_COD,number (1),Etat matrimonial,DS_MAR_V,2013,,
KI_CCI_R,DCD_CIM_COD,string (4),Cause initiale du décès,IR_CIM_V,2013,,
KI_CCI_R,DCD_CAU_COD,number (1),Recherche de la cause de décès,DS_CAU_V,2013,,
KI_CCI_R,DCD_GRS_COD,number (1),La grossesse a contribué au décès,DS_GRS_V,2013,,
KI_CCI_R,DCD_GRS_DEL,string (4),Délai entre fin de grossesse et décès,-,2013,,
KI_CCI_R,DCD_LIE_LIB,string (200),Lieu de lévènement si mort violente,-,2013,,
KI_CCI_R,DCD_ATT_COD,number (1),Accident du travail,DS_ATT_V,2013,,
KI_CCI_R,NEO_APG_SCO,number (2),Apgar à une minute,-,2013,,
KI_CCI_R,NEO_GES_AGE,number (2),Âge gestationnel en semaines révolues daménorrhée,-,2013,,
KI_CCI_R,NEO_NAI_POI,"number (4,0)",Poids de naissance en grammes,-,2013,,
KI_CCI_R,RNG_NAI_TYP,number (1),Type de naissance,DS_NAI_V,2013,,
KI_CCI_R,GRS_ORD_NUM,number (1),N° dordre de lenfant si grossesse multiple,-,,,
KI_CCI_R,ACC_LIA_COD,number (1),Lieu daccouchement,DS_LIA_V,2013,,
KI_CCI_R,ACC_PST_COD,number (1),Présentation de lenfant,DS_PST_V,2013,,
KI_CCI_R,ACC_DEB_COD,number (1),Début du travail,DS_DEB_V,2013,,
KI_CCI_R,MOD_ACC_COD,number (1),Mode daccouchement,DS_ACC_V,2013,,
KI_CCI_R,HOS_TRF_TOP,number (1),Transfert ou hospitalisation particulière de lenfant,DS_TRF_V,2013,,
KI_CCI_R,MER_NAI_ANN,string (4),Année de naissance de la mère,-,2013,,
KI_CCI_R,MER_PFS_COD,number (1),Activité professionnelle de la mère,DS_PFS_V,2013,,
KI_CCI_R,MER_PFG_LIB,string (50),Profession de la mère exercée pendant la grossesse,-,2013,,
KI_CCI_R,MER_MAR_COD,number (1),Etat matrimonial de la mère,DS_MAR_V,,,
KI_CCI_R,MER_SIT_TOP,number (1),La mère vit elle en couple,DS_SIT_V,2013,,
KI_CCI_R,TOT_GRS_NBR,number (2),Nombre total de grossesses,-,2013,,
KI_CCI_R,TOT_ACC_NBR,number (2),Nombre total daccouchements,-,2013,,
KI_CCI_R,PER_PFS_COD,number (1),Activité professionnelle du père,DS_PFS_V,2013,,
KI_CCI_R,PER_PFG_LIB,string (50),Profession du père exercée pendant la grossesse,-,2013,,
KI_ECD_R,DCD_IDT_ENC,string (64),Identifiant décès encodé,-,2013,,
KI_ECD_R,DCD_IDT_TOP,number (1),Top apparié avec IR_BEN_R,-,2013,,
KI_ECD_R,BEN_IDT_ANO,string (18),Identifiant bénéficiaire anonymisé,-,2013,,
KI_ECD_R,BEN_IDT_TOP,number (1),Top identifiant bénéficiaire Anonymisé,-,2013,,
KI_ECD_R,BEN_NIR_ANO,string (17),NIR pseudonymisé du bénéficiaire,-,2013,,
KI_ECD_R,FLX_PER_ANN,string (4),Année de décès,-,2013,,
KI_ECD_R,CER_LIG_NUM,number (1),N° de ligne du certificat de décès,-,2013,,
KI_ECD_R,ECD_CAU_RNG,number (3),Rang de la cause,-,2013,,
KI_ECD_R,ECD_CAU_LIB,string (100),Libellé de la cause,-,2013,,
KI_ECD_R,ECD_CIM_COD,string (4),Code de la cause,IR_CIM_V,2013,,
KI_ECD_R,BEN_DCD_DTE,date (8),Date de décès du bénéficiaire,IR_DTE_V,2013,,
KI_ECD_R,BEN_DCD_AME,string (6),Année et mois de décès du bénéficiaire,-,2013,,
MA_REM_FT,PRE_INS_DPT,string (3),Département du professionnel de santé prescripteur,IR_DPT_V,,,
MA_REM_FT,FLX_DIS_DTD,date (8),Date de mise à disposition des données,-,,,
MA_REM_FT,ORG_CLE_NUM,string (9),organisme de liquidation des prestations (avant fusion des caisses),IR_ORG_V,,,
MA_REM_FT,DDP_COD,number (3),Code de la discipline de Prestations (ou discipline médico tarifaire),IR_DDP_V,,,
MA_REM_FT,ETP_CAT_COD,number (4),Catégorie d'établissement prescripteur,IR_CET_V,,,
MA_REM_FT,FLT_DEP_MNT,"number (17,2)",Montant du dépassement de la prestation,-,,,
MA_REM_FT,PRS_REM_MNT,"number (13,2)",Montant remboursé,-,,,
MA_REM_FT,PSE_STJ_COD,number (2),Mode d'exercice du professionnel de santé exécutant,IR_SJP_V,,,
MA_REM_FT,MTM_NAT,number (1),Modulation du ticket modérateur,IR_MTM_V,,,
MA_REM_FT,PSE_CNV_COD,number (1),Code convention du professionnel de santé exécutant,IR_CNV_V,,,
MA_REM_FT,EXF_ANN_MOI,string (6),Année Mois fin de soin exécution,-,,,
MA_REM_FT,AGE_BEN_COD,number (4),Age du bénéficiaire au moment des Soins,IR_AGE_V,,,
MA_REM_FT,EXO_MTF,number (2),Motif d'exonération du ticket modérateur,IR_EXO_V,,,
MA_REM_FT,PSP_STJ_COD,number (2),Mode d'exercice du professionnel de santé prescripteur,IR_SJP_V,,,
MA_REM_FT,PSP_CAT_COD,number (3),Catégorie du PS prescripteur,IR_CAT_V,,,
MA_REM_FT,TOP_PS5_TRG,number (2),Top PS5 Tous Régimes,-,,,
MA_REM_FT,FLT_REM_MNT,"number (15,2)",Montant versé - remboursé (Part de base uniquement),-,,,
MA_REM_FT,ETE_IND_TAA,number (1),Indicateur TAA,IR_TAA_V,,,
MA_REM_FT,PRS_REM_TAU,number (3),Taux de remboursement réel (régime obligatoire),-,,,
MA_REM_FT,PRS_NAT,number (5),Nature de prestation,IR_NAT_V,,,
MA_REM_FT,MFT_COD,number (2),Code du mode de fixation des tarifs,IR_MFT_V,,,
MA_REM_FT,ETP_STJ_COD,number (3),Statut juridique de l'établissement prescripteur,IR_SJE_V,,,
MA_REM_FT,PSE_SPE_COD,number (2),Spécialite médicale du professionnel de santé exécutant,IR_SPE_V,,,
MA_REM_FT,DRG_AFF_NAT,string (2),Code affiné du destinataire du règlement,-,,,
MA_REM_FT,FLT_ACT_NBR,number (12),Dénombrement de la prestation,-,,,
MA_REM_FT,BEN_SEX_COD,number (1),Code sexe du bénéficiaire,IR_SEX_V,,,
MA_REM_FT,DRT_ACS_TOP,string (1),Top bénéficiaire ACS,IR_BAC_V,,,
MA_REM_FT,MDT_COD,number (2),Code du mode de traitement,IR_MDT_V,,,
MA_REM_FT,MUT_ORG,number (4),N° SLM d'affiliation,IR_SLM_V,,,
MA_REM_FT,PRS_ACT_COG,"number (9,2)",Coefficient global de l'acte de base,-,,,
MA_REM_FT,FLT_PAI_MNT,"number (17,2)",Montant de la dépense de la prestation,-,,,
MA_REM_FT,RGM_COD,number (3),Code du petit régime,IR_RGM_V,,,
MA_REM_FT,PRS_REM_BSE,"number (13,2)",Base de remboursement,-,,,
MA_REM_FT,PRS_NAT_REF,number (4),Code de la Prestations de référence,IR_NAT_V,,,
MA_REM_FT,PSP_SPE_COD,number (2),Spécialité médicale du professionnel de santé prescripteur,IR_SPE_V,,,
MA_REM_FT,BEN_CMU_TOP,string (1),Top bénéficiaire de la CMU complémentaire,-,,,
MA_REM_FT,PSE_ACT_NAT,number (2),Nature d'activité du professionnel de santé exécutant,IR_ACT_V,,,
MA_REM_FT,EXE_INS_DPT,string (3),Département du professionnel de santé exécutant,IR_DPT_V,,,
MA_REM_FT,ORG_CAI_NUM,string (3),N° Caisse de liquidation pour le RG,IR_CAI_V,,,
MA_REM_FT,FLT_ACT_QTE,number (12),Quantité de la prestation,-,,,
MA_REM_FT,BEN_CMU_CAT,string (1),Catégorie d'organisme complémentaire CMU,IR_COC_V,,,
MA_REM_FT,PRS_PDS_QCP,number (2),Code qualificatif du parcours de soins,IR_QPS_V,,,
MA_REM_FT,ETE_CAT_COD,number (3),Catégorie de l'établissement exécutant,IR_CET_V,,,
MA_REM_FT,REM_ANN_MOI,string (6),Année Mois de remboursement,-,,,
MA_REM_FT,ETP_DPT_COD,string (3),Departement de l'établissement prescripteur,IR_DPT_V,,,
MA_REM_FT,ETE_STJ_COD,number (3),Statut Juridique de l'établissement juridique,IR_SJE_V,,,
MA_REM_FT,FLT_ACT_COG,"number (13,2)",Coefficient Global de la prestation,-,,,
MA_REM_FT,ASU_NAT,number (3),Nature de l'assurance,IR_ASU_V,,,
MA_REM_FT,PRS_ACT_QTE,number (5),Quantité de l'acte de base,-,,,
MA_REM_FT,EXD_ANN_MOI,string (6),Année Mois début de soin exécution,-,,,
MA_REM_FT,SOI_ANN,string (4),Année de soin PS5,-,,,
MA_REM_FT,ORG_AFF_BEN,string (9),Code de l'organisme d'affiliation,IR_ORG_V,,,
MA_REM_FT,CPT_ENV_TYP,number (3),Type d'enveloppe,IR_ENV_V,,,
MA_REM_FT,RGM_GRG_COD,number (3),Grand régime de liquidation du bénéficiaire,IR_RGM_V,,,
MA_REM_FT,PSE_CAT_COD,number (3),Catégorie du PS exécutant,IR_CAT_V,,,
MA_REM_FT,BEN_QLT_COD,number (3),Qualité du bénéficiaire,IR_BEQ_V,,,
MA_REM_FT,PRS_FJH_TYP,number (2),Type de prise en charge Forfait Journalier,IR_FJH_V,,,
MA_REM_FT,PRS_DEP_MNT,"number (11,2)",Montant global du dépassement,-,,,
MA_REM_FT,ETE_DPT_COD,string (3),Département de l'établissement exécutant,IR_DPT_V,,,
MA_REM_FT,PSP_CNV_COD,number (1),Code convention du professionnel de santé prescripteur,IR_CNV_V,,,
MA_REM_FT,BEN_RES_DPT,string (3),Département de résidence du bénéficiaire,IR_DPT_V,,,
MA_REM_FT,BEN_CTA_TYP,number (3),Type de contrat complémentaire,-,,,
MA_REM_FT,PRS_ACT_NBR,number (5),Dénombrement des actes de base,-,,,
MA_REM_FT,ETE_TYP_COD,number (2),Code du type de l'établissement exécutant,IR_TYE_V,,,
MA_REM_FT,TOP_PS5_RG,number (2),Top PS5 Régime Général,-,,,
MA_REM_FT,FLX_EMT_TYP,number (2),Type d'émetteur,IR_TYT_V,,,
MA_REM_FT,BEN_NAI_ANN,string (4),Année de naissance du bénéficiaire,-,,,
MA_REM_FT,SOI_MOI,string (2),Mois de soin PS5,-,,,
MA_REM_FT,CPL_COD,number (1),Majorations hors actes CCAM - complément dacte,IR_CPA_V,,,
MA_REM_FT,PRS_PAI_MNT,"number (11,2)",Montant global de la dépense,-,,,
MA_REM_FT,DPN_QLF,number (2),Qualificatif de la dépense,IR_DEP_V,,,
MA_REM_FT,PRS_REM_TYP,number (3),Type de remboursement,IR_TYR_V,,,
MA_REM_FT,FLX_ANN_MOI,string (6),Année et Mois de traitement,-,,,
MA_REM_FT,FLX_EMT_NUM,number (4),numéro d'émetteur du flux,IR_NEM_T,,,
MA_REM_FT,ATT_NAT,number (2),Nature de l'accident du travail,IR_ATT_V,,,
MA_REM_FT,PSP_ACT_NAT,number (2),Nature d'activite du professionnel de santé prescripteur,IR_ACT_V,,,
MA_REM_FT,PRS_PPU_SEC,number (1),Code privé - public de la Prestations,IR_PPU_V,,,
NS_BIO_F,CLE_DCI_JNT,number (8),Clé technique de jointure,-,,,
NS_BIO_F,BEN_IDT_ANO,string (18),Identifiant bénéficiaire anonymisé,-,,,
NS_BIO_F,BEN_IDT_TOP,number (1),Top identifiant bénéficiaire Anonymisé,-,,,
NS_BIO_F,EXE_SOI_DTD,date (8),Date de début d'exécution des soins,IR_DTE_V,,,
NS_BIO_F,EXE_SOI_DTF,date (8),Date de fin d'exécution des soins,IR_DTE_V,,,
NS_BIO_F,EXE_SOI_AMD,string (6),Date (année et mois) de début d'exécution des soins,IR_DTE_V,,,
NS_BIO_F,EXE_SOI_AMF,string (6),Date (année et mois) de fin d'exécution des soins,IR_DTE_V,,,
NS_BIO_F,PFS_EXE_NUM,string (8),N° du professionnel de santé exécutant,-,,,
NS_BIO_F,PFS_PRE_NUM,string (8),N° du professionnel de santé prescripteur,-,,,
NS_BIO_F,GRG_LIQ_COD,string (3),Grand régime de liquidation,-,,,
NS_BIO_F,CAI_LIQ_COD,string (3),Code de la caisse de liquidation,IR_CAI_V,,,
NS_BIO_F,PRS_NAT_REF,number (4),Code de la Prestations de référence,IR_NAT_V,,,
NS_BIO_F,ETB_PRE_FIN,string (8),N° FINESS de l'établissement prescripteur,-,,,
NS_BIO_F,ETB_EXE_FIN,string (8),N° FINESS de l'établissement exécutant,-,,,
NS_BIO_F,RGO_REM_TAU,"number (5,2)",Taux de remboursement (part Régime Obligatoire),-,,,
NS_BIO_F,GRG_AFF_COD,string (3),Code du grand régime d'affiliation,-,,,
NS_BIO_F,CAI_AFF_COD,string (3),Code de la caisse d'affiliation,IR_CAI_V,,,
NS_BIO_F,SLM_AFF_COD,string (3),Code de la SLM,IR_SLM_V,,,
NS_BIO_F,FLX_TRT_DTD,date (8),Date d'entrée des données dans le système d'information,IR_DTE_V,,,
NS_BIO_F,FLX_DIS_DTD,date (8),Date de mise à disposition des données,IR_DTE_V,,,
NS_BIO_F,FLX_EMT_TYP,number (2),Type d'émetteur,IR_TYT_V,,,
NS_BIO_F,EXE_INS_DPT,string (3),Département du professionnel de santé exécutant,IR_DPT_V,,,
NS_BIO_F,PRE_INS_DPT,string (3),Département du professionnel de santé prescripteur,IR_DPT_V,,,
NS_BIO_F,ETE_DPT_COD,string (3),Département de l'établissement exécutant,IR_DPT_V,,,
NS_BIO_F,ETP_DPT_COD,string (3),Departement de l'établissement prescripteur,IR_DPT_V,,,
NS_BIO_F,BEN_RES_DPT,string (3),Département de résidence du bénéficiaire,IR_DPT_V,,,
NS_BIO_F,BIO_SEQ_NUM,number (8),Numéro séquentiel,-,,,
NS_BIO_F,BIO_PRS_IDE,number (4),Code NABM de l'acte de biologie,IR_BIO_R,,,
NS_BIO_F,BIO_ACT_QSN,number (5),Quantité d'actes de biologie,-,,,
NS_CAM_F,CLE_DCI_JNT,number (8),Clé technique de jointure,-,,,
NS_CAM_F,BEN_IDT_ANO,string (18),Identifiant bénéficiaire anonymisé,-,,,
NS_CAM_F,BEN_IDT_TOP,number (1),Top identifiant bénéficiaire Anonymisé,-,,,
NS_CAM_F,EXE_SOI_DTD,date (8),Date de début d'exécution des soins,IR_DTE_V,,,
NS_CAM_F,EXE_SOI_DTF,date (8),Date de fin d'exécution des soins,IR_DTE_V,,,
NS_CAM_F,EXE_SOI_AMD,string (6),Date (année et mois) de début d'exécution des soins,IR_DTE_V,,,
NS_CAM_F,EXE_SOI_AMF,string (6),Date (année et mois) de fin d'exécution des soins,IR_DTE_V,,,
NS_CAM_F,PFS_EXE_NUM,string (8),N° du professionnel de santé exécutant,-,,,
NS_CAM_F,PFS_PRE_NUM,string (8),N° du professionnel de santé prescripteur,-,,,
NS_CAM_F,GRG_LIQ_COD,string (3),Grand régime de liquidation,-,,,
NS_CAM_F,CAI_LIQ_COD,string (3),Code de la caisse de liquidation,IR_CAI_V,,,
NS_CAM_F,PRS_NAT_REF,number (4),Code de la Prestations de référence,IR_NAT_V,,,
NS_CAM_F,ETB_PRE_FIN,string (8),N° FINESS de l'établissement prescripteur,-,,,
NS_CAM_F,ETB_EXE_FIN,string (8),N° FINESS de l'établissement exécutant,-,,,
NS_CAM_F,RGO_REM_TAU,"number (5,2)",Taux de remboursement (part Régime Obligatoire),-,,,
NS_CAM_F,GRG_AFF_COD,string (3),Code du grand régime d'affiliation,-,,,
NS_CAM_F,CAI_AFF_COD,string (3),Code de la caisse d'affiliation,IR_CAI_V,,,
NS_CAM_F,SLM_AFF_COD,string (3),Code de la SLM,IR_SLM_V,,,
NS_CAM_F,FLX_TRT_DTD,date (8),Date d'entrée des données dans le système d'information,IR_DTE_V,,,
NS_CAM_F,FLX_DIS_DTD,date (8),Date de mise à disposition des données,IR_DTE_V,,,
NS_CAM_F,FLX_EMT_TYP,number (2),Type d'émetteur,IR_TYT_V,,,
NS_CAM_F,EXE_INS_DPT,string (3),Département du professionnel de santé exécutant,IR_DPT_V,,,
NS_CAM_F,PRE_INS_DPT,string (3),Département du professionnel de santé prescripteur,IR_DPT_V,,,
NS_CAM_F,ETE_DPT_COD,string (3),Département de l'établissement exécutant,IR_DPT_V,,,
NS_CAM_F,ETP_DPT_COD,string (3),Departement de l'établissement prescripteur,IR_DPT_V,,,
NS_CAM_F,BEN_RES_DPT,string (3),Département de résidence du bénéficiaire,IR_DPT_V,,,
NS_CAM_F,CAM_SEQ_NUM,number (8),Numéro séquentiel,-,,,
NS_CAM_F,CAM_PRS_IDE,string (13),Code CCAM de l'acte médical,IR_CCAM_V54,,,
NS_CAM_F,CAM_ACT_COD,string (1),Code activite,XC_ATE_V,,,
NS_CAM_F,CAM_ACT_PRU,"number (7,2)",Prix unitaire CCAM de l'acte médical,-,,,
NS_CAM_F,CAM_ASS_COD,string (1),Code association,IR_ASS_V,,,
NS_CAM_F,CAM_DOC_EXT,string (1),Extension documentaire,-,,,
NS_CAM_F,CAM_MOD_COD,string (4),Codes modificateurs,-,,,
NS_CAM_F,CAM_REM_COD,string (1),Code remboursement exceptionnel,-,,,
NS_CAM_F,CAM_TRT_PHA,number (1),Phase de traitement,XC_PHA_V,,,
NS_CAM_F,CAM_QUA_DEN,string (32),Localisation dentaire,-,,,
NS_CAM_F,CAM_REM_BSE,"number (7,2)",Base de remboursement de la CCAM,-,,,
NS_CAM_F,CAM_GRI_TAR,string (3),Grille tarifaire,-,,,
NS_CAM_F,CAM_ACT_QSN,number (5),Quantité d'actes CCAM,-,,,
NS_DTR_F,CLE_DCI_JNT,number (8),Clé technique de jointure,-,,,
NS_DTR_F,BEN_IDT_ANO,string (18),Identifiant bénéficiaire anonymisé,-,,,
NS_DTR_F,BEN_IDT_TOP,number (1),Top identifiant bénéficiaire Anonymisé,-,,,
NS_DTR_F,EXE_SOI_DTD,date (8),Date de début d'exécution des soins,IR_DTE_V,,,
NS_DTR_F,EXE_SOI_DTF,date (8),Date de fin d'exécution des soins,IR_DTE_V,,,
NS_DTR_F,EXE_SOI_AMD,string (6),Date (année et mois) de début d'exécution des soins,IR_DTE_V,,,
NS_DTR_F,EXE_SOI_AMF,string (6),Date (année et mois) de fin d'exécution des soins,IR_DTE_V,,,
NS_DTR_F,PFS_EXE_NUM,string (8),N° du professionnel de santé exécutant,-,,,
NS_DTR_F,PFS_PRE_NUM,string (8),N° du professionnel de santé prescripteur,-,,,
NS_DTR_F,GRG_LIQ_COD,string (3),Grand régime de liquidation,-,,,
NS_DTR_F,CAI_LIQ_COD,string (3),Code de la caisse de liquidation,IR_CAI_V,,,
NS_DTR_F,PRS_NAT_REF,number (4),Code de la Prestations de référence,IR_NAT_V,,,
NS_DTR_F,ETB_PRE_FIN,string (8),N° FINESS de l'établissement prescripteur,-,,,
NS_DTR_F,ETB_EXE_FIN,string (8),N° FINESS de l'établissement exécutant,-,,,
NS_DTR_F,RGO_REM_TAU,"number (5,2)",Taux de remboursement (part Régime Obligatoire),-,,,
NS_DTR_F,GRG_AFF_COD,string (3),Code du grand régime d'affiliation,-,,,
NS_DTR_F,CAI_AFF_COD,string (3),Code de la caisse d'affiliation,IR_CAI_V,,,
NS_DTR_F,SLM_AFF_COD,string (3),Code de la SLM,IR_SLM_V,,,
NS_DTR_F,FLX_TRT_DTD,date (8),Date d'entrée des données dans le système d'information,IR_DTE_V,,,
NS_DTR_F,FLX_DIS_DTD,date (8),Date de mise à disposition des données,IR_DTE_V,,,
NS_DTR_F,FLX_EMT_TYP,number (2),Type d'émetteur,IR_TYT_V,,,
NS_DTR_F,EXE_INS_DPT,string (3),Département du professionnel de santé exécutant,IR_DPT_V,,,
NS_DTR_F,PRE_INS_DPT,string (3),Département du professionnel de santé prescripteur,IR_DPT_V,,,
NS_DTR_F,ETE_DPT_COD,string (3),Département de l'établissement exécutant,IR_DPT_V,,,
NS_DTR_F,ETP_DPT_COD,string (3),Departement de l'établissement prescripteur,IR_DPT_V,,,
NS_DTR_F,BEN_RES_DPT,string (3),Département de résidence du bénéficiaire,IR_DPT_V,,,
NS_DTR_F,DTR_SEQ_NUM,number (8),Numéro séquentiel,-,,,
NS_DTR_F,TRS_PRS_IDE,number (13),"Code affiné du transport (forfait, km, majoration, supplément)",IR_DTR_V,,,
NS_DTR_F,TRS_ACT_PRU,"number (10,5)",Prix unitaire du code affiné du transport,-,,,
NS_DTR_F,TRS_TRS_MTF,number (3),Motif du transport,IR_MTR_V,,,
NS_DTR_F,TRS_ACT_QSN,number (5),Nombre de Km facturés ou de forfaits ou de majorations ou de suppléments,IR_MTR_V,,,
NS_INV_F,CLE_DCI_JNT,number (8),Clé technique de jointure,-,,,
NS_INV_F,BEN_IDT_ANO,string (18),Identifiant bénéficiaire anonymisé,-,,,
NS_INV_F,BEN_IDT_TOP,number (1),Top identifiant bénéficiaire Anonymisé,-,,,
NS_INV_F,EXE_SOI_DTD,date (8),Date de début d'exécution des soins,IR_DTE_V,,,
NS_INV_F,EXE_SOI_DTF,date (8),Date de fin d'exécution des soins,IR_DTE_V,,,
NS_INV_F,EXE_SOI_AMD,string (6),Date (année et mois) de début d'exécution des soins,IR_DTE_V,,,
NS_INV_F,EXE_SOI_AMF,string (6),Date (année et mois) de fin d'exécution des soins,IR_DTE_V,,,
NS_INV_F,PFS_EXE_NUM,string (8),N° du professionnel de santé exécutant,-,,,
NS_INV_F,PFS_PRE_NUM,string (8),N° du professionnel de santé prescripteur,-,,,
NS_INV_F,GRG_LIQ_COD,string (3),Grand régime de liquidation,-,,,
NS_INV_F,CAI_LIQ_COD,string (3),Code de la caisse de liquidation,IR_CAI_V,,,
NS_INV_F,PRS_NAT_REF,number (4),Code de la Prestations de référence,IR_NAT_V,,,
NS_INV_F,ETB_PRE_FIN,string (8),N° FINESS de l'établissement prescripteur,-,,,
NS_INV_F,ETB_EXE_FIN,string (8),N° FINESS de l'établissement exécutant,-,,,
NS_INV_F,RGO_REM_TAU,"number (5,2)",Taux de remboursement (part Régime Obligatoire),-,,,
NS_INV_F,GRG_AFF_COD,string (3),Code du grand régime d'affiliation,-,,,
NS_INV_F,CAI_AFF_COD,string (3),Code de la caisse d'affiliation,IR_CAI_V,,,
NS_INV_F,SLM_AFF_COD,string (3),Code de la SLM,IR_SLM_V,,,
NS_INV_F,FLX_TRT_DTD,date (8),Date d'entrée des données dans le système d'information,IR_DTE_V,,,
NS_INV_F,FLX_DIS_DTD,date (8),Date de mise à disposition des données,IR_DTE_V,,,
NS_INV_F,FLX_EMT_TYP,number (2),Type d'émetteur,IR_TYT_V,,,
NS_INV_F,EXE_INS_DPT,string (3),Département du professionnel de santé exécutant,IR_DPT_V,,,
NS_INV_F,PRE_INS_DPT,string (3),Département du professionnel de santé prescripteur,IR_DPT_V,,,
NS_INV_F,ETE_DPT_COD,string (3),Département de l'établissement exécutant,IR_DPT_V,,,
NS_INV_F,ETP_DPT_COD,string (3),Departement de l'établissement prescripteur,IR_DPT_V,,,
NS_INV_F,BEN_RES_DPT,string (3),Département de résidence du bénéficiaire,IR_DPT_V,,,
NS_INV_F,INV_SEQ_NUM,number (8),Numéro séquentiel,-,,,
NS_INV_F,INV_PEN_CAT,number (2),Catégorie de la pension d'invalidité,IR_CIV_V,,,
NS_INV_F,INV_PEN_ETA,number (2),Etat de la pension d'invalidité,IR_EIN_V,,,
NS_INV_F,INV_ATR_DTD,date (8),Date d'attribution de la pension d'invalidité,IR_DTE_V,,,
NS_PHA_F,CLE_DCI_JNT,number (8),Clé technique de jointure,-,,,
NS_PHA_F,BEN_IDT_ANO,string (18),Identifiant bénéficiaire anonymisé,-,,,
NS_PHA_F,BEN_IDT_TOP,number (1),Top identifiant bénéficiaire Anonymisé,-,,,
NS_PHA_F,EXE_SOI_DTD,date (8),Date de début d'exécution des soins,IR_DTE_V,,,
NS_PHA_F,EXE_SOI_DTF,date (8),Date de fin d'exécution des soins,IR_DTE_V,,,
NS_PHA_F,EXE_SOI_AMD,string (6),Date (année et mois) de début d'exécution des soins,IR_DTE_V,,,
NS_PHA_F,EXE_SOI_AMF,string (6),Date (année et mois) de fin d'exécution des soins,IR_DTE_V,,,
NS_PHA_F,PFS_EXE_NUM,string (8),N° du professionnel de santé exécutant,-,,,
NS_PHA_F,PFS_PRE_NUM,string (8),N° du professionnel de santé prescripteur,-,,,
NS_PHA_F,GRG_LIQ_COD,string (3),Grand régime de liquidation,-,,,
NS_PHA_F,CAI_LIQ_COD,string (3),Code de la caisse de liquidation,IR_CAI_V,,,
NS_PHA_F,PRS_NAT_REF,number (4),Code de la Prestations de référence,IR_NAT_V,,,
NS_PHA_F,ETB_PRE_FIN,string (8),N° FINESS de l'établissement prescripteur,-,,,
NS_PHA_F,ETB_EXE_FIN,string (8),N° FINESS de l'établissement exécutant,-,,,
NS_PHA_F,RGO_REM_TAU,"number (5,2)",Taux de remboursement (part Régime Obligatoire),-,,,
NS_PHA_F,GRG_AFF_COD,string (3),Code du grand régime d'affiliation,-,,,
NS_PHA_F,CAI_AFF_COD,string (3),Code de la caisse d'affiliation,IR_CAI_V,,,
NS_PHA_F,SLM_AFF_COD,string (3),Code de la SLM,IR_SLM_V,,,
NS_PHA_F,FLX_TRT_DTD,date (8),Date d'entrée des données dans le système d'information,IR_DTE_V,,,
NS_PHA_F,FLX_DIS_DTD,date (8),Date de mise à disposition des données,IR_DTE_V,,,
NS_PHA_F,FLX_EMT_TYP,number (2),Type d'émetteur,IR_TYT_V,,,
NS_PHA_F,EXE_INS_DPT,string (3),Département du professionnel de santé exécutant,IR_DPT_V,,,
NS_PHA_F,PRE_INS_DPT,string (3),Département du professionnel de santé prescripteur,IR_DPT_V,,,
NS_PHA_F,ETE_DPT_COD,string (3),Département de l'établissement exécutant,IR_DPT_V,,,
NS_PHA_F,ETP_DPT_COD,string (3),Departement de l'établissement prescripteur,IR_DPT_V,,,
NS_PHA_F,BEN_RES_DPT,string (3),Département de résidence du bénéficiaire,IR_DPT_V,,,
NS_PHA_F,PHA_SEQ_NUM,number (8),Numéro séquentiel,-,,,
NS_PHA_F,PHA_PRS_C13,number (13),Code CIP de la pharmacie de ville (13 Caractères),IR_PHA_R,,,
